[
  {
    "id": 1,
    "url": "battleJudoka.html",
    "category": "mainMenu",
    "order": 20,
    "isHidden": false,
    "gameModeId": 1
  },
  {
    "id": 2,
    "url": "teamBattleSelection.html",
    "category": "subMenu",
    "order": 30,
    "isHidden": true,
    "gameModeId": 2
  },
  {
    "id": 3,
    "url": "judokaUpdateSelection.html",
    "category": "subMenu",
    "order": 40,
    "isHidden": true,
    "gameModeId": 3
  },
  {
    "id": 4,
    "url": "teamBattleMale.html",
    "category": "teamBattle",
    "order": 50,
    "isHidden": true,
    "gameModeId": 4
  },
  {
    "id": 5,
    "url": "teamBattleFemale.html",
    "category": "teamBattle",
    "order": 60,
    "isHidden": true,
    "gameModeId": 5
  },
  {
    "id": 6,
    "url": "teamBattleMixed.html",
    "category": "teamBattle",
    "order": 70,
    "isHidden": true,
    "gameModeId": 6
  },
  {
    "id": 7,
    "url": "browseJudoka.html",
    "category": "mainMenu",
    "order": 80,
    "isHidden": false,
    "gameModeId": 7
  },
  {
    "id": 8,
    "url": "createJudoka.html",
    "category": "manageJudoka",
    "order": 90,
    "isHidden": true,
    "gameModeId": 8
  },
  {
    "id": 9,
    "url": "updateJudoka.html",
    "category": "mainMenu",
    "order": 30,
    "isHidden": true,
    "gameModeId": 9
  },
  {
    "id": 11,
    "url": "meditation.html",
    "category": "mainMenu",
    "order": 85,
    "isHidden": false,
    "gameModeId": 11
  },
  {
    "id": 12,
    "url": "randomJudoka.html",
    "category": "mainMenu",
    "order": 40,
    "isHidden": false,
    "gameModeId": 12
  },
  {
    "id": 13,
    "url": "settings.html",
    "category": "mainMenu",
    "order": 90,
    "isHidden": false,
    "gameModeId": 13
  }
]
